{
 "_credit": {
  "dataset": "The Structured Torah",
  "version": "2026-09-rev1",
  "attribution": "Moshe Kline, The Structured Torah (chaver.com)",
  "license": "CC BY 4.0",
  "license_url": "https://creativecommons.org/licenses/by/4.0/",
  "website": "https://chaver.com",
  "documentation": "https://chaver.com/torah-weave/api/index.json",
  "schema": "https://chaver.com/torah-weave/api/schema.json",
  "canonical": "https://chaver.com/torah-weave/api/leviticus/17.json"
 },
 "reference": {
  "book": "Leviticus",
  "book_he": "ספר ויקרא",
  "slug": "leviticus",
  "unit": 17,
  "unit_roman": "XVII",
  "serial_number": 55,
  "title": "Animal Birth",
  "verses": "Leviticus 22:26-22:33",
  "verse_range": "22:26-22:33",
  "verse_range_he": "כב:כו-לג",
  "heading_he": "ספר ויקרא יחידה XVII (כב:כו-לג)",
  "sefaria_ref": "Leviticus 22:26-22:33"
 },
 "structure": {
  "format": "2x2",
  "shape": [
   [
    1,
    1
   ],
   [
    1,
    1
   ]
  ],
  "rows": 2,
  "columns": 2,
  "cells": 4,
  "subdivisions": 0,
  "type": null,
  "irregular": false,
  "unique": false,
  "markers": {},
  "marker_count": 0
 },
 "rows": [
  {
   "row_num": 1,
   "cells": [
    {
     "label": "1א",
     "label_key": "1A",
     "position": {
      "row": 1,
      "col": 1,
      "colspan": 1
     },
     "text": "1א\nכב:כו וידבר יהוה אל משה לאמר כב:כז שור או כשב או עז כי יולד והיה שבעת ימים תחת אמו ומיום השמיני והלאה ירצה לקרבן אשה ליהוה",
     "runs": [
      {
       "text": "1א\n",
       "marker": null
      },
      {
       "text": "כב:כו וידבר יהוה אל משה לאמר כב:כז שור או כשב או עז כי יולד והיה שבעת ימים תחת אמו ומיום השמיני והלאה ירצה לקרבן אשה ליהוה",
       "marker": null
      }
     ],
     "markers": [],
     "verses": [
      {
       "ref_he": "כב:כו",
       "chapter": 22,
       "verse": 26,
       "ref": "Leviticus 22:26",
       "offset": 3
      },
      {
       "ref_he": "כב:כז",
       "chapter": 22,
       "verse": 27,
       "ref": "Leviticus 22:27",
       "offset": 32
      }
     ],
     "verse_range": "22:26-22:27"
    },
    {
     "label": "1ב",
     "label_key": "1B",
     "position": {
      "row": 1,
      "col": 2,
      "colspan": 1
     },
     "text": "1ב\nכב:כח ושור או שה אתו ואת בנו לא תשחטו ביום אחד כב:כט וכי תזבחו זבח תודה ליהוה לרצנכם תזבחו כב:ל ביום ההוא יאכל לא תותירו ממנו עד בקר אני יהוה ",
     "runs": [
      {
       "text": "1ב\n",
       "marker": null
      },
      {
       "text": "כב:כח ושור או שה אתו ואת בנו לא תשחטו ביום אחד כב:כט וכי תזבחו זבח תודה ליהוה לרצנכם תזבחו כב:ל ביום ההוא יאכל לא תותירו ממנו עד בקר אני יהוה ",
       "marker": null
      }
     ],
     "markers": [],
     "verses": [
      {
       "ref_he": "כב:כח",
       "chapter": 22,
       "verse": 28,
       "ref": "Leviticus 22:28",
       "offset": 3
      },
      {
       "ref_he": "כב:כט",
       "chapter": 22,
       "verse": 29,
       "ref": "Leviticus 22:29",
       "offset": 50
      },
      {
       "ref_he": "כב:ל",
       "chapter": 22,
       "verse": 30,
       "ref": "Leviticus 22:30",
       "offset": 94
      }
     ],
     "verse_range": "22:28-22:30"
    }
   ]
  },
  {
   "row_num": 2,
   "cells": [
    {
     "label": "2א",
     "label_key": "2A",
     "position": {
      "row": 2,
      "col": 1,
      "colspan": 1
     },
     "text": "2א\nכב:לא ושמרתם מצותי ועשיתם אתם אני יהוה",
     "runs": [
      {
       "text": "2א\n",
       "marker": null
      },
      {
       "text": "כב:לא ושמרתם מצותי ועשיתם אתם אני יהוה",
       "marker": null
      }
     ],
     "markers": [],
     "verses": [
      {
       "ref_he": "כב:לא",
       "chapter": 22,
       "verse": 31,
       "ref": "Leviticus 22:31",
       "offset": 3
      }
     ],
     "verse_range": "22:31-22:31"
    },
    {
     "label": "2ב",
     "label_key": "2B",
     "position": {
      "row": 2,
      "col": 2,
      "colspan": 1
     },
     "text": "2ב\n  כב:לב ולא תחללו את שם קדשי ונקדשתי בתוך בני ישראל אני יהוה מקדשכם כב:לג המוציא אתכם מארץ מצרים להיות לכם לאלהים אני יהוה {פ}",
     "runs": [
      {
       "text": "2ב\n",
       "marker": null
      },
      {
       "text": "  כב:לב ולא תחללו את שם קדשי ונקדשתי בתוך בני ישראל אני יהוה מקדשכם כב:לג המוציא אתכם מארץ מצרים להיות לכם לאלהים אני יהוה {פ}",
       "marker": null
      }
     ],
     "markers": [],
     "verses": [
      {
       "ref_he": "כב:לב",
       "chapter": 22,
       "verse": 32,
       "ref": "Leviticus 22:32",
       "offset": 5
      },
      {
       "ref_he": "כב:לג",
       "chapter": 22,
       "verse": 33,
       "ref": "Leviticus 22:33",
       "offset": 71
      }
     ],
     "verse_range": "22:32-22:33"
    }
   ]
  }
 ],
 "source_page": "https://chaver.com/torah-weave/Leviticus/hebrew-leviticus-unit-17/hebrew-leviticus-unit-17.html",
 "source_page_en": "https://chaver.com/torah-weave/Leviticus/leviticus-unit-17/leviticus-unit-17.html"
}